{
  "meta": {
    "uuid": "19b74406-569b-4b00-b9e9-6a1df9d4a8e9",
    "creation_date": "2022-12-09T08:07:13.066718Z",
    "upload_date": "2022-12-09T08:07:13.066719Z"
  },
  "results": [
    {
      "benchmark_id": "id",
      "benchmark_name": "name",
      "loadgen_scenario": "SingleStream",
      "backend_settings": {
        "accelerator_code": "",
        "accelerator_desc": "",
        "framework": "",
        "model_path": "",
        "batch_size": 0,
        "extra_settings": [
          {
            "id": "shards_num",
            "name": "Shards number",
            "value": "2",
            "value_name": "2"
          }
        ]
      },
      "performance_run": {
        "throughput": 123.45,
        "accuracy": {
          "normalized": 0.123,
          "formatted": "12.3%"
        },
        "accuracy2": {
          "normalized": 0.123,
          "formatted": "12.3%"
        },
        "dataset": {
          "name": "Imagenet classification validation set",
          "type": "IMAGENET",
          "data_path": "mlperf_datasets/imagenet/img",
          "groundtruth_path": "mlperf_datasets/imagenet/imagenet_val_full.txt"
        },
        "measured_duration": 123.456,
        "measured_samples": 8,
        "start_datetime": "2022-12-09T15:07:13.070330",
        "loadgen_info": {
          "validity": true,
          "duration": 10.6
        }
      },
      "accuracy_run": {
        "throughput": 123.45,
        "accuracy": {
          "normalized": 0.123,
          "formatted": "12.3%"
        },
        "accuracy2": {
          "normalized": 0.123,
          "formatted": "12.3%"
        },
        "dataset": {
          "name": "Imagenet classification validation set",
          "type": "IMAGENET",
          "data_path": "mlperf_datasets/imagenet/img",
          "groundtruth_path": "mlperf_datasets/imagenet/imagenet_val_full.txt"
        },
        "measured_duration": 123.456,
        "measured_samples": 8,
        "start_datetime": "2022-12-09T15:07:13.070407",
        "loadgen_info": {
          "validity": true,
          "duration": 10.6
        }
      },
      "min_duration": 10.5,
      "min_samples": 8,
      "backend_info": {
        "filename": "tflite",
        "vendor_name": "tflite",
        "backend_name": "libtflitebackend",
        "accelerator_name": "accelerator"
      }
    },
    {
      "benchmark_id": "id",
      "benchmark_name": "name",
      "loadgen_scenario": "SingleStream",
      "backend_settings": {
        "accelerator_code": "",
        "accelerator_desc": "",
        "framework": "",
        "model_path": "",
        "batch_size": 0,
        "extra_settings": [
          {
            "id": "shards_num",
            "name": "Shards number",
            "value": "2",
            "value_name": "2"
          }
        ]
      },
      "performance_run": {
        "throughput": 123.45,
        "accuracy": {
          "normalized": 0.123,
          "formatted": "12.3%"
        },
        "accuracy2": {
          "normalized": 0.123,
          "formatted": "12.3%"
        },
        "dataset": {
          "name": "Imagenet classification validation set",
          "type": "IMAGENET",
          "data_path": "mlperf_datasets/imagenet/img",
          "groundtruth_path": "mlperf_datasets/imagenet/imagenet_val_full.txt"
        },
        "measured_duration": 123.456,
        "measured_samples": 8,
        "start_datetime": "2022-12-09T15:07:13.071638",
        "loadgen_info": {
          "validity": true,
          "duration": 10.6
        }
      },
      "accuracy_run": {
        "throughput": 123.45,
        "accuracy": {
          "normalized": 0.123,
          "formatted": "12.3%"
        },
        "accuracy2": {
          "normalized": 0.123,
          "formatted": "12.3%"
        },
        "dataset": {
          "name": "Imagenet classification validation set",
          "type": "IMAGENET",
          "data_path": "mlperf_datasets/imagenet/img",
          "groundtruth_path": "mlperf_datasets/imagenet/imagenet_val_full.txt"
        },
        "measured_duration": 123.456,
        "measured_samples": 8,
        "start_datetime": "2022-12-09T15:07:13.071638",
        "loadgen_info": {
          "validity": true,
          "duration": 10.6
        }
      },
      "min_duration": 10.5,
      "min_samples": 8,
      "backend_info": {
        "filename": "tflite",
        "vendor_name": "tflite",
        "backend_name": "libtflitebackend",
        "accelerator_name": "accelerator"
      }
    }
  ],
  "environment_info": {
    "platform": "android",
    "value": {
      "android": {
        "os_version": "",
        "manufacturer": "",
        "model_code": "",
        "model_name": "",
        "board_code": "",
        "proc_cpuinfo_soc_name": "",
        "props": [
          {
            "type": "socName",
            "name": "",
            "value": ""
          }
        ]
      },
      "ios": {
        "os_version": "",
        "model_code": "",
        "model_name": "",
        "soc_name": ""
      },
      "windows": {
        "os_version": "",
        "cpu_full_name": ""
      }
    }
  },
  "build_info": {
    "version": "1.0",
    "build_number": "10qwe",
    "build_date": "2022-12-09T15:07:13.069544",
    "official_release_flag": false,
    "dev_test_flag": true,
    "backend_list": [
      "libtflitebackend"
    ],
    "git_branch": "feature",
    "git_commit": "as91230jr90qwe",
    "git_dirty_flag": false
  }
}